id,title,text,author,language,keywords
113,"بررسي جريان خون مغناطيسي در طول رگ مخروطي گرفته شده با ترکيبي از گرفتگي و آنوريسم: يک روش صريح تفاضل متناهي
",ما تجزیه و تحلیلی را برای بررسی اثر میدان مغناطیسی بر ویژگی‌های جریان خون ضربانی در یک شریان مخروطی انجام دادیم. دلیل اصلی در نظر گرفتن میدان مغناطیسی در مدل ارائه شده این است که جریان خون جریان الکتریسیته را هدایت می کند و به طور تجربی ثابت شده است که جریان جریان خون می تواند در حضور میدان مغناطیسی به طور قابل توجهی تحت تأثیر قرار گیرد. برای شبیه‌سازی شرایط واقعی بدن انسان، دیواره سرخرگ را مخروطی و الاستیک با ترکیبی از تنگی و آنوریسم فرض کرده‌اند. مدل غیر نیوتنی در نظر گرفته شده با مایع کراس برای توصیف رئولوژی جریان خون مشخص می شود. PDE حاکم به صورت عددی با استفاده از روش تفاضل محدود حل می شود. اثرات پارامترهای متمایز از جمله آنوریسم، تنگی، ماهیت ضربانی جریان خون و میدان مغناطیسی بر روی سرعت جریان خون، سرعت جریان حجمی و امپدانس مقاومت توسط نمودارهای نمایشی آنها ارائه شده است.,نسیم اصغری,Persian,خون مغناطیسی بدن رگ
114,روش های آزمایشگاهی جایگزین در تدریس آزمایشگاه شیمی (مقاله مروری)," آزمایشگاه بخشی ضروری در آموزش و یادگیری شیمی است, اما ارایه آن در دوره ها و برنامه های برخط یا آموزش از راه دور چالش برانگیز است. مطالعات زیادی در این زمینه به ویژه بعد از شیوع بیماری کووید 19 و لزوم استفاده از روش های جایگزین انجام شده و نشان داده شده است که روش های آزمایشگاهی جایگزین می توانند عملکردی مشابه با تجربه آزمایشگاه حضوری برای دانش آموزان و دانشجویان ایجاد کنند. در این مقاله, پنج روش آزمایشگاهی (یعنی حضوری, مجازی, کنترل از راه دور, بسته های آزمایشگاهی آزمایش در خانه و به میزان کمتر روش گردش علمی خودآموز) را بررسی می کنیم که ممکن است در ارایه کیفیت فعالیت های آزمایشگاهی عملی به منظور پشتیبانی از مطالعات برخط مورد استفاده قرار گیرند. هر روش نقاط قوت و ضعف مخصوص به خود را دارد و می تواند به صورت جداگانه یا در ترکیب با روش های دیگر استفاده شود. انتخاب و ادغام این روش ها, که حاصل نتایج یادگیری و سایر عوامل است, به عنوان بخشی از فرآیند طراحی بررسی می شود. در نهایت, طراحی آزمایشگاه در آینده به طور قطع شامل فن آوری های جدید خواهد بود, اما به طور بالقوه عناصری مانند منابع آموزشی باز, یادگیری تحلیلی, طراحی جهانی و علم شهروندی در آن تاثیرگذار است.",نسیم اصغری,Persian,"
آزمایشگاه برخط از راه دور مجازی بسته آموزشی مطالعه در خانه آموزش شیمی "
115,مقايسه تأثير روش هاي مختلف ارزشيابي توصيفي بر پيشرفت تحصيلي دانش آموزان دختر پايه سوم ابتدائي در دروس مختلف,"هدف از اين تحقيق بررسي مقايسه تأثير روش هاي مختلف ارزشيابي توصيفي بر پيشرفت تحصيلي دانش آموزان دختر پايه سوم ابتدايي در دروس مختلف بوده است. روش تحقيق در اين پژوهش توصيفي- پيمايشي بوده، و ابزار مورد استفاده در اين پژوهش چك ليست محقق ساخته و پرسشنامه نظر سنجي از معلمان محقق ساخته بوده كه جهت سنجش روايي ابزار مورد استفاده از روايي صوري و محتوايي استفاده شد و اعتبارپرسشنامه برابر با 0/93 =a بدست آمد. جامعه آماري اين پژوهش شامل كليه دانش آموزان دختر پايه سوم ابتدايي مدارس زرين شهر كه در كل 742 نفر و نيز شامل معلمان پايه سوم ابتدايي كه 34 نفر بوده است، كه 147 نفر از دانش آموزان و 28 نفر از معلمان از طريق نمونه گيري خوشه اي و تصادفي انتخاب شدند. براي تجزيه و تحليل سوالات پژوهش از آزمون خي دو استفاده شد. نتايج نشان داد كه استفاده از روش هاي مختلف ارزشيابي توصيفي در بهبود عملكرد دانش آموزان در دروس قرآن، تعليمات اجتماعي، هنر، علوم و فارسي مؤثر بوده است و در بهبود عملكرد دانش آموزان در درس هديه هاي آسماني و رياضي موثر نبوده است؛ و همچنين، نتايج تحليل پرسشنامه اي كه از نظر سنجي معلمان در ارزشيابي پيشرفت تحصيلي بدست آمد، نشان داد كه معلمان بسته به نوع دروس و امكانات موجود از روش ها و ابزارهاي متنوع ارزشيابي توصيفي استفاده مي كنند.و در نهايت نتايج نظر سنجي نشان داد كه معلمان براي ارزشيابي كليه
دروس پايه سوم ابتدايي ارزشيابي توصيفي را مناسب تر از ارزشيابي سنتي مي دانند. كلمات كليدي: ارزشيابي، ارزشيابي توصيفي، ارزشيابي سنتي، علمكرد دانش آموزان", محمدرضا سرمدي,Persian,پیشرفت تحصیلی؛ اهداف شناختی؛ اهداف مهارتی؛ روش تدریس کاوشگری؛ آموزش مستقیم
116,بررسی فرایند طرح مسئله دانش آموزان دوره ابتدایی,"هدف اصلی پژوهش حاضر، بررسی فرایند طرح مسئله دانش آموزان سال پنجم ابتدایی می باشد. در این
مطالعه 386 نفر از دانش آموزان دختر و پسر شهر تهران که در سال تحصیلی 1391 – 1390 مشغول به تحصیل بودند، به روش نمونه گیري خوشه اي چند مرحله اي انتخاب شدند. این مطالعه از نظر هدف کاربردي و از نظر اجرا، توصیفی– پیمایشی است. ابزار گرد آوري داده ها براي بررسی فرایند طرح مسئله دانش آموزان و مشکلات آنها در این زمینه، آزمون محقق ساخته اي است که از 7 تکلیف طرح مسئله نیمه ساختار یافته مطابق با مدل استویانوا و در مورد چهار عمل اصلی تشکیل شده است. به منظور تجزیه و تحلیل اطلاعات بدست آمده از این آزمون، روشهاي آمار توصیفی) فراوانی و درصد داده ها( و آمار استنباطی)آزمون خی دو( مورد استفاده قرار گرفت. روایی صوري و پایایی آزمون مورد تایید کارشناسان آموزش ریاضی قرار گرفت و با استفاده از روش کورد- ریچاردسون عدد 824/. براي هماهنگی درونی آزمون به دست آمد. نتایج به دست آمده از این تحقیق نشان داد که دانش آموزان جامعه آماري مورد پژوهش در طرح مسئله بسیار ضعیف هستند که علت اساسی این مشکل در درك سطحی و ضعیف آنها در مفهوم چهار عمل اصلی تشخیص داده شد. همچنین نتایج پژوهش حاضر نشان داد که دانش آموزان در طرح مسائل زمینه مدار و صورت بندي و مدل سازي مسائل دنیاي واقعی تقریباٌ هیچ تجربه اي ندارند و همین مسئله موجب کاربردي نبودن دانش آنها در تمام زمینه ها، حتی ریاضی می باشد. نتایج به دست آمده نشان دهنده ذهن غیر منعطف دانش آموزان در طرح مسائل مربوط به مفهوم ضرب نیز شد. عملکرد طرح مسئله دانش آموزان به تفکیک طبقه اجتماعی نیز مورد بررسی قرار گرفت و نتایج به دست آمده نشان داد که درك دانش آموزان برخوردار از مفهوم کسر و تقسیم و ضرب نسبت به دانش آموزان محروم بالاتر است. نتایج به دست آمده ضعف دانش آموزان در طرح مسائل کلامی را نشان می دهد، همچنین
رابطه مستقیم توانایی طرح مسئله را با قدرت درك مسائل و بیان خوب نشان می دهد. کلمات کلیدي: دانش آموزان ابتدایی، مسئله، درك، طرح مسئله، طبقه اجتماعی",ابراهیم ریحانی,Persian,خلاقیت  ایده  طرح‌مسئله  معلمان ابتدائی
117,بررسی توانایی دانش آموزان در طرح مسئلهي ریاضی و رابطهي آن با خلاقیت و دانش ریاضی (هندسه),یکی از حوزههاي تحقیقاتی آموزش ریاضی که اخیراً مورد توجه جامعهي جهانی قرار گرفته است، طرح مسئله میباشد. تحقیقات انجام شده در آموزش ریاضی، از پیوند طرح مسئله با بسیاري از حوزههاي پژوهشی دیگر نظیر؛ حل مسئله، خلاقیت و غیره خبر میدهند. پژوهش حاضر نیز سه هدف عمده را در رابطه با طرح مسئله دنبال میکند، که عبارتند از: ارزیابی توانایی دانشآموزان در طراحی مسائل ریاضی )هندسه(، بررسی رابطهي طرح مسئله با خلاقیت، و بررسی رابطهي طرح مسئله با دانش ریاضی دانشآموزان. در این پژوهش تعداد 71 نفر دانشآموز پایهي سوم متوسطه از مدارس استعدادهاي درخشان شهر کرمان شرکت نمودند و به سؤالات دو آزمون طرح مسئله، دانش ریاضی، و پرسشنامهي خلاقیت پاسخ دادند. همچنین جهت آگاهی از نقطه نظرات دانش- آموزان در مورد طرح مسئله و اعتبار بخشیدن به یافتهها، با 7 تن از دانشآموزان مصاحبهاي به عمل آمد. نتایج به دست آمده نشان داد، عملکرد دانشآموزان در طرح مسئلهي ریاضی امیدوارکننده میباشد. بنابراین تجربهي بیشتر در این زمینه میتواند به رشد این توانایی در دانشآموزان کمک کند. همچنین یافتهها از مثبت بودن رابطهي بین توانایی طرح مسئله با خلاقیت، و طرح مسئله با دانش ریاضی دانشآموزان حکایت دارند. علاوه بر این، در پژوهش حاضر، مدلی جهت ارزیابی کمی مسائل طرح شدهي دانشآموزان ارائه گردید. کلید واژه: طرح مسئله، خلاقیت، دانش ریاضی، هندسه، دانشآموزان، دورهي متوسطه.,محمد رضا فدایی,Persian,راه‌حل‌های چندگانه، نگرش نسبت به ریاضی، آموزش ریاضی
118,بررسی درك دانش آموزان سال پنجم ابتدایی از اعمال جمع، تفریق و ضرب با استفاده از تکالیف طرح مسأله,"چکیده: هدف این تحقیق که به روش توصیفی-پیمایشی انجام شده است، بررسی درك دانشآموزان سال پنجم ابتدایی از سه عمل جمـع، تفریـق و ضرب، با استفاده از تکالیف طرح مسأله است. بدین منظور، آزمونی شامل دو موقعیت طرح مسأله طراحی شد. براي تجزیه و تحلیل دادهها، مدل رایلی و همکاران )1983( و دستهبندي یپ بانهار )2009( مورد استفاده قرار گرفت. نمونه مورد مطالعه شامل 358 دانشآموز کلاس پنجم، از هشت مدرسـه در چهار منطقه تهران است که به روش نمونهگیري خوشهاي چند مرحلهاي انتخاب شدند. نتایج تحقیق نشان داد، با وجود اینکه دانشآمـوزان مسـائل نسبتا متعددي طرح کرده بودند اما اغلب این مسائل فاقد تنوع و ابتکار بود. در واقع، در موقعیت طـرح مسـأله در رابطـه بـا ضـرب، حـدود 58 درصـد دانشآموزان مسائلی از نوع همتراز طرح کردند و در هر کدام از چهار دسته دیگر، فراوانی کمتر از 10 درصد بود. در موقعیت طرح مسـأله در رابطـه بـا جمع و تفریق نیز حدود 64 درصد مسائل، تنها در دو دسته -تغییر با نتیجهي مجهول )افزایش( و ترکیب با مجموع مجهول- طـرح شـده بودنـد و در هریک از دوازده دسته دیگر، فراوانی کمتر از 15 درصد بود. به نظر میرسد اکثر دانشآموزان جمع، تفریق و ضرب را به صورت رویهاي درك کردهاند. به همین دلیل در طرح مسأله مرتبط با این اعمال، خود را در قالبهایی که آموزش دیدهاند محصور میکنند. برخی از دانشآموزان در طرح مسأله، تطابق با دنیاي واقعی را نادیده گرفته بودند. طرح مسائل مرتبط با تجارب شخصی، از نکات قابل توجه دیگري بود که در بررسـی مسـائل طـرح شـده توسـط
دانشآموزان مشاهده شد. واژگان کلیدي: دانشآموزان، پنجم ابتدایی، طرح مسأله ریاضی، عملهاي جمع، تفریق و ضرب.",ابراهیم ریحانی,Persian,برنامه درسی ریاضی، کتاب ریاضی، ضرب و تقسیم، اعداد و عملیات، دبستان، تجزیه و تحلیل محتوا
119,"تحلیل محتوای کتاب‌های درسی ریاضی دوره اول متوسطه ایران بر اساس تعابیر مختلف احتمال
",هدف از انجام مطالعه حاضر، تحلیل محتوای بخش احتمال در کتاب‌های درسی ریاضی دوره اول متوسطه ایران بر اساس تعابیر کلاسیک، فراوانی‌گرا و ذهنی از احتمال است. این پژوهش، از نظر هدف، کاربردی و از نظر نحوه گردآوری داده‌ها توصیفی محسوب می‌شود. رویکرد پژوهش، کمّی است و با روش تحلیل محتوایِ مقوله‌ای انجام شده است. جامعه آماری، کتاب‌های درسی ریاضی پایه‌های هفتم، هشتم و نهم چاپ 1400 و نمونه، به صورت هدفمند، بخش احتمال این کتاب‌ها انتخاب شده است. ابزار پژوهش، فرم تحلیل محتوای محقق ­ساخته بر اساس تعابیر سه‌گانه احتمال است. روایی محتوایی و صوری ابزار پژوهش توسط تنی چند از اعضای هیئت علمی دانشگاه‌های کشور در رشته‌های آموزش ریاضی، آمار و برنامه‌ریزی درسی و مؤلفین کتب درسی ریاضی مورد تأیید قرار گرفت. جهت اطمینان از پایایی روش کدگذاری، درصد توافق بین کدگذاران محاسبه شد. یافته‌های پژوهش نشان داد که 76 درصد از تکالیف موجود در بخش احتمالِ کتب درسی ریاضی دوره اول متوسطه بر حسب تعبیر کلاسیک طراحی شده‌ است و دو تعبیر دیگر فقط 24 درصد از تکالیف را در بر می‌گیرد. از این 24 درصد، فقط 5 درصد به تعبیر فراوانی‌گرا مرتبط است و این میزان برای تعبیر فراوانی‌گرا، به عنوان مکمل تعبیر کلاسیک کافی به نظر نمی‌رسد. بررسی های تکمیلی نشان داد که در سه کتاب مزبور، فقط یک تکلیف با هدف برقراری ارتباط بین تعابیر احتمال طراحی شده است. ,ابراهیم ریحانی,Persian,تحلیل محتوا؛ کتاب‌های درسی ریاضی؛ دوره اول متوسطه؛ تعابیر کلاسیک؛ فراوانی‌گرا و ذهنی از احتمال
120,اثربخشی آموزش، با استفاده از مثالهای ساخته شده توسط نرمافزار جئوجبرا در یادگیری قضایای هندسه متوسطه دوم.,زمینه و هدف: هدف از این پژوهش بررسی استفاده از مثال‌های محقق‌ساخته توسط نرم‌افزار GeoGebra به‌عنوان ابزاری آموزشی برای افزایش مهارت‌های یادگیری قضایای هندسی و سنجش نگرش دانش‌آموزان ریاضی پایه یازدهم نسبت به هندسه و ارائه الگوی کاربردی برای تدریس است. هندسه. روش کار: این پژوهش از نوع نیمه آزمایشی با گروه آزمایش و گروه کنترل است. از پیش آزمون و پس آزمون استفاده می کند و از نظر هدف کاربردی است. جامعه آماری پژوهش حاضر شامل دانش آموزان دختر پایه یازدهم ریاضی نواحی سه و چهار شهر اصفهان در سال تحصیلی 91-1390 بود که نمونه آماری شامل 120 دانش آموز با استفاده از نمونه در دسترس به صورت هدفمند انتخاب شد. روش. پیش آزمون درس هندسه 1 و آزمون هوش کتل سه مقیاسی برای همه گروه ها به صورت یکسان اجرا شد. پرسشنامه محقق ساخته در مقیاس لیکرت پنج درجه ای برای ارزیابی نگرش دانش آموزان نسبت به هندسه قبل و بعد از تحقیق در اختیار همه گروه ها قرار گرفت. برای سنجش روایی پرسشنامه از نظرات مشاوران و معلمان مجرب آموزش و پرورش استفاده شد و پس از تصحیح در اختیار دانش آموزان قرار گرفت. برای تعیین پایایی سوالات از ضریب آلفای کرونباخ استفاده شد. پایایی 0.93 نشان دهنده پایایی بالای پرسشنامه است. به گروه آزمایشی نحوه استفاده، ساخت اشکال ساده و اندازه گیری اجزای اشکال در جئوجبرا از طریق فضای مجازی آموزش داده شد و در پنج جلسه یک ساعته، مسائل آنها توسط محقق حل شد. محققی با استفاده از نظرات پنج استاد و مدرس مجرب 9 مثال کاربردی مربوط به مقاطع دایره و دگرگونی در هندسه 2 ایجاد کرد که پاسخ آنها با استفاده از نرم افزار GeoGebra طراحی و در اختیار گروه آزمایش قرار گرفت. آنها با استفاده از این نرم افزار قطعات را حدس زدند و صحت آنها را بررسی کردند. سپس پاسخ های صحیح به آنها داده شد. آنها همچنین شکل اصلی قضایای مربوطه را استنباط کرده و آنها را نشان دادند. در این مدت، مطالب این بخش از کتاب به صورت سنتی به گروه های کنترل داده شد. پس آزمون در پایان این دوره برای همه گروه ها به طور یکسان اجرا شد. برای تجزیه و تحلیل داده های به دست آمده از بخش استنباطی نرم افزار SPSS 25 که شامل آنالیز MANCOVA، آزمون کولموگروف اسمیرنوف، آزمون لوین و آزمون M box بود استفاده شد. یافته‌ها: نتایج تحلیل MANCOVA نشان می‌دهد که استفاده از مثال‌های ساخته‌شده توسط نرم‌افزار GeoGebra در مقایسه با آموزش سنتی از نظر آماری تأثیر معناداری بر توانایی دانش‌آموزان در حدس زدن و یادگیری قضایای هندسی دارد. علاوه بر این، پرسشنامه ای که در اختیار دانش آموزان قرار می گیرد نشان می دهد که برای حل این مثال ها و حدس زدن و اثبات قضایای مربوط به آن ها از جئوجبرا استفاده می کنند و انگیزه بیشتری برای شرکت در کلاس هندسه دارند. نتیجه‌گیری: با توجه به یافته‌ها، روش تدریس اثبات یک قضیه هندسی با استفاده از مثال‌های ساخته‌شده توسط نرم‌افزار جئوجبرا، میزان یادگیری در کلاس را افزایش می‌دهد و انگیزه دانش‌آموزان را برای یادگیری هندسه افزایش می‌دهد و کلاس درس را برای آنها جذاب‌تر می‌کند. این روش خلاقیت دانش آموزان را افزایش می دهد و باعث می شود که آنها در فرآیند یادگیری بیشتر درگیر شوند و در کلاس درس فعال تر شوند و این مهارت ها دانش آموزان را قادر می سازد و یادگیری را در کلاس هندسه تسهیل می کند. مشکلاتی در تحقیق وجود داشت. به عنوان مثال، برخی از مدیران مدارس از اجازه دادن به این روش در آموزش هندسه خودداری کردند. برخی از معلمان هندسه نیز با نرم افزار GeoGebra آشنایی نداشتند. دوره های ضمن خدمت در این زمینه برای معلمان ریاضی ایده آل است که می خواهند به دانش آموزان خود کمک کنند هندسه را به طور مؤثرتر و مشتاقانه تر یاد بگیرند.,ابراهیم ریحانی,Persian,مثال ها؛ نرم افزار جئوجبرا؛ هندسه
