id,title,text,author,language,keywords
36,Identifying barriers to using flipped class in Iranian higher education,"The current literature on flipped classrooms offers limited insights into the motivations, perceptions, and challenges of educators, especially in higher education. The purpose of this qualitative study is to understand the motivations of teachers to adopt the flipped classroom method and the challenges and problems that educators face when teaching in the form of information in a public university. In this study, semi-structured interviews were used to collect information. Thirteen professors who had previously taught using the flipped classroom method were interviewed. Data were analyzed using content analysis method. Peer assistance was used to increase the reliability and validity of the analysis. The findings of this study showed several challenges related to the use of flipped teaching method in Iranian higher education: 1) managerial and structural weakness of the higher education system, 2) weak content required in the flipped classroom, 3) individual barriers in relation to knowledge and attitude And information of students and professors, 4) Weakness of technology. These findings could potentially be used as a guide for educators who want to use the flipped classroom method to improve their students' learning outcomes.
In the third millennium, with the introduction of information and communication technologies in the field of life, the proper use of educational systems from these technologies in teaching and learning is one of the major professional challenges in most societies (Parsa Moin, 2020). It is popular where activities that were traditionally done in the classroom (for example, presenting material) become homework and activities that were normally called homework become lesson activities. Akçayır et all., 2018) In the reverse classroom, the instructor helps students to take responsibility for the learning process instead of just providing information, and in fact promotes inclusive learning (Lai & Hwang, 2016). . Because class time is not used to impart knowledge to students through lectures, the instructor is able to engage with students through other learning activities such as discussion, problem solving suggested by students, helpful activities, and guidance. Today, the concept of reverse class is implemented in many different disciplines (mathematics, social sciences, humanities, etc.) and in schools and universities around the world (Hao, 2016). As a popular new educational model, the reverse class has attracted a lot of attention in recent years. Research on reverse class, especially in higher education, has increased dramatically. In general, the literature on this topic focuses mainly on the benefits and challenges of reverse classrooms (Ho & et all, 2018).
Researchers have discussed the benefits of inverted classrooms to justify their effectiveness. Another important benefit of such a classroom is that it can enhance active learning. In the reverse classroom, students are more involved in meaningful learning activities, self-centered learning, in-depth information processing, and achieving more learning (Lai & Hwang, 2016). The problem is used, which leads to deep learning (Maciejewski, 2016), citing self-centered learning theory, claiming that active presence in the reverse classroom may meet students' need for independence, solidarity and competence, and thus Improve students' motivation and learning. Flexibility is another benefit of the reverse classroom that is often discussed by researchers. Using step-by-step self-help videos enables students to quickly, at any time, place, confront themselves with pause, rewind, review, or video lectures (Karabulut-Ilgu, 2018). Regarding student participation in an inverted classroom, Qualifi concluded that the emotional dimensions of learning should not be underestimated. Dimensions such as peer commitment, recognition, a sense of security, and the coaching relationship are particularly highlighted as contributors to student learning (Steen-Utheim & Foldnes, 2018). Another study showed that reverse teaching method was more effective in students' learning than traditional (explanatory) teaching method (Mobaser Maleki & Kian, 2018).
Although the reverse classroom has many benefits for improving learning, it also has some drawbacks. Some studies do not support the effectiveness of the reverse class compared to the traditional class, or even show that the reverse class discussion undermines group learning (McClelland, 2013; Velegol, 2015;). The biggest challenge of using the classroom approach is the heavy workload created for faculty and students. Turning a traditional course into a reverse course creates a significant workload and workload for professors (Howitt and Pegrum, 2015). As noted (Wanner & Palmer, 2015), the actual time used to prepare a reverse class course is approximately six times longer than the preparation time of a traditional course. To effectively implement the reverse classroom approach, the instructor has to design the curriculum, including objectives, content, instructions, and reassessment. Teachers should prepare pre-class video lectures and in-class activities. Even their PowerPoint slides have been redesigned to make them better at online personal learning. In-class activities also require more investment from the instructor to design, monitor, guide and provide feedback. Students should also make more efforts for learner-centered. Students must complete significant amounts of preparation through class before entering class, including watching pre-class video lectures, reviewing other instructional materials, completing online tests, and completing extracurricular activities. In the traditional classroom, students need to discuss and engage with peers and give lectures to solve their academic problems. Therefore, facing a large amount of information along with the feeling of drowning in a lot of work will cause anxiety and frustration for students. They may not be interested in learning online, give up and resist classroom activities, and are therefore dissatisfied with the reverse class approach (Karabulut ‐ Ilgu, 2018). Another important challenge of using the class is The reverse lesson is the lack of theoretical and practical framework for the design and implementation of this model (Karabulut ‐ Ilgu, 2018), which creates a major obstacle and prevents educators from using this type.
A large number of experimental studies have focused on the effectiveness of flipped classrooms. A significant body of research has generally demonstrated the benefits of this educational approach in terms of improving student learning, including understanding, participation, learning approach, motivation, general skills, satisfaction, and academic achievement (Al-Zahrani, 2015; Zainuddin & Attaran, 2016; Hung, 2015). Researchers have discussed the benefits of flipped classrooms to justify their effectiveness. One of the most important benefits of such classrooms is that it can promote active learning. In the flipped classroom, students are more involved in meaningful learning activities, self-directed learning, deep information processing, and achieving more learning (Bishop & Verleger, 2013; Hwang & Lai, 2016; Davies, 2013). Moreover, class time is used more for social interaction, peer support, group discussion, and problem solving, which lead to deep learning (Hao 2016; Gilboy et al., 2015; Maciejewski, 2016). Abeysekera and Dawson (2015), referring to self-directed learning theory, claimed that active participation in flipped classrooms may fulfil students’ need for autonomy, solidarity, and competence, thereby improving students’ motivation and learning.",جمیله علم الهدی,En,چالش های آموزش عالی کلاس درس تحول
37,کلاس معکوس در آموزش عالی ایران: با تاکید بر مزایای آن برای فراگیران,کلاس‌های معکوس به عنوان یک روش آموزشی برای بهبود درگیری دانشجویان، مهارت‌های تفکر انتقادی، پیامد‌های یادگیری و موفقیت در حال رشد هستند. با این حال، ادبیات فعلی در کلاس‌های درس معکوس، بینش محدودی در مورد انگیزه‌ها، ادراک‌ها و مزایای فراگیران، به ویژه در زمینه آموزش عالی ارائه می‌دهد. هدف از این مطالعه کیفی، درک مدرسان کلاس معکوس در آموزش عالی ایران، با تأکید بر مزایای آن برای فراگیران بود که مربیان هنگام تدریس در قالب کلاس معکوس در یک دانشگاه دولتی با آن روبرو می‌شوند. به طور خاص، در این مطالعه بهترین استراتژی‌ها برای اجرای کلاس‌های درس معکوس ذکر شده است. پژوهش حاضر مطالعه‌ای کیفی از نظر هدف کاربردی و از جهت روش پژوهش کیفی و مبتنی بر پارادایم تفسیری و با رویکرد استقرایی در این مطالعه از مصاحبه نیمه ساختار یافته برای گرداوری اطلاعات استفاده شده است. ۱۳ نفر از اساتید که قبلاً با استفاده از روش کلاس معکوس، تدریس می‌کردند، مصاحبه شدند. داده‌ها با استفاده از روش تحلیل مضمون مورد بررسی و تحلیل قرار گرفتند. برای افزایش پایایی و اعتبار تجزیه و تحلیل، از کمک همکار استفاده شد. یافته‌های این پژوهش چندین مزایای مرتبط با بکارگیری روش تدریس معکوس در آموزش عالی ایران را نشان داد: ۱) افزایش کیفیت یادگیری، ۲) تقویت تفکر سطح بالا و ۳) اجتماعی کردن فراگیران. این یافته‌ها به طور بالقوه می‌توانند به عنوان راهنمایی برای مدرسانی که می‌خواهند برای بهبود نتیجه یادگیری دانشجویان خود از روش کلاس درس معکوس سود ببرند، استفاده شود.,جمیله علم الهدی,Persian,آموزش عالی  فراگیران آموزش معکوس  کلاس معکوس  مزایای کلاس معکوس
38,طراحی و اعتباریابی الگوی تربیت توحیدی در دوره نوجوانی از دیدگاه قرآن و روایات,این پژوهش با هدف طراحی و اعتباریابی الگوی تربیت توحیدی بر اساس آموزه‌های قرآن و روایات در دوره نوجوانی انجام گرفت. در راستای دستیابی به هدف پژوهش، از روش ترکیبی، از نوع اکتشافی متوالی استفاده شد. در بخش کیفی پژوهش، از روش تحلیل محتوای استقرایی و در بخش کمی، از روش پیمایشی استفاده گردید. جامعه آماری در بخش کمی تمامی دانش‌آموزان و معلمان مقطع متوسطه شهر کرج بودند. همچنین در بخش کیفی پژوهش جامعه آماری شامل کلیه آیات و روایات، اسناد، مقالات، و کتاب‌ها بودند که به شیوه هدفمند انتخاب‌ شده و مورد تحلیل محتوای استقرایی قرار گرفت. همچنین نمونه آماری مرحله اعتبارسنجی الگو را تعداد 23 نفر از متخصصان تشکیل دادند که به ‌عنوان نمونه هدفمند انتخاب شدند. طبق تحلیل محتوای انجام‌شده، چهار مؤلفه اصلی و 15 زیرمؤلفه برای مؤلفه‌های اصلی استخراج شدند. پس از تحلیل محتوا و استخراج کدها، مؤلفه‌ها و زیرمؤلفه‌ها در قالب الگو ارائه گردید. ابتدا الگوی مفهومی که دربرگیرنده همه این عناصر بود طراحی شد. به ‌منظور بررسی اعتبار درونی الگوی پیشنهادی از پرسشنامه استفاده شد.,جمیله علم الهدی,Persian,اعتبارسنجی؛ الگوی تربیت توحیدی؛ دوره نوجوانی؛ قرآن و روایات
39,شناسایی الگوی مطلوب نظارت بر پایان نامه ها مطالعه ی موردی دانشکده علوم تربیتی و روانشناسی دانشگاه شهید بهشتی,پژوهش حاضر در صدد است با رویکرد کیفی به شناسایی الگوی مطلوب نظارت بر پایان نامه ها بپردازد. داده های مورد نظر، پس از مصاحبه با تعداد 11نفر از اعضای هیات علمی دانشکده علوم تربیتی و روانشناسی دانشکده علوم تربیتی و روانشناسی دانشگاه شهید بهشتی با روش نمونه گیری هدفمند و مصاحبه نیمه سازمان یافته، به اشباع نظری دست یافت. سپس مرحله تحلیل داده ها، در سه مرحله کدگذاری باز و محوری و گزینشی جهت شناسایی الگوی مطلوب نظارت بر پایان نامه ها صورت پذیرفت. اعتباریابی فرایند و یافته های تحقیق از طریق راهبردهای مقایسه مداوم، مشارکت اعضاء، مرورهمتا، توضیح شیوه های یادداشت برداری و انجام گزارش انجام شد. نتایج حاصله نشان می دهد که الگوی مطلوب نظارت بر پایان نامه ها متشکل از مقوله های کلی، فردی (استاد راهنما) و سازمانی است. هم چنین مقوله فردی، دارای مقوله های اصلی ساختاری و حمایتی و مقوله سازمانی نیز دارای مقوله های اصلی برنامه ریزی و یادگیری می باشد. ضرورت اهتمام به گویه های مستخرج از مقوله کلی فردی و سازمانی جهت بهبود فرایند نظارت بر پایان نامه ها توصیه می شود.,محمد قهرمانی,Persian,نظارت بر پایان نامه‌ها؛ وظایف استاد راهنما؛ دانشجویان تحصیلات تکمیلی
40,بررسی چالش های آموزشی ، پژوهشی و سازمانیِ اعضای هیأت علمی تازه کار دانشگاه قندهار افغانستان,پژوهش حاضر با هدف شناسایی و بررسی چالش های آموزشی، پژوهشی و سازمانی اعضای هیأت علمی تازه کار کشور افغانستان در تطابق با معیاری های نوین آموزش و پژوهش  از دیدگاه صاحب نظران به روش آمیخته اکتشافی (کمی و کیفی) انجام شده است. در بخش کیفی تحقیق حاضر مشارکت کنندگان شامل 33  تن از خبرگان، صاحب نظران، استادان دانشگاه ها، رییس و معاونان دانشگاه و استادان تازه کار به صورت هدفمند برای انجام مصاحبه انتخاب شد. در بخش کمی جامعه آماری پژوهش حاضر شامل استادان تازه کار دانشگاه قندهار است که کمتر از۱۰سال سابقه کار داشته باشند. حجم جامعه آماری در بخش کمی مشتمل بر 190 نفر استاد تازه کاراست. نمونه گیری نیز براساس جدول مورگان برابر با 122 نفر تعیین شد. جمع آوری داده ها در مرحله نخست با ابزار مصاحبه نیمه ساختار یافته و به روش تحلیل محتوا، بررسی پاسخ به سوالات مصاحبه و تحلیل اسناد انجام شد؛ در بررسی اسناد تمامی اسناد موجود در زمینه موضوع پژوهش که پژوهشگر به آن دسترسی داشت، مورد بررسی قرار داد و با استفاده از تحلیل محتوا، محتوای مورد نیاز استخراج و استفاده شد. در مرحله دوم پس از تدوین پرسشنامه بر اساس نظرات مصاحبه شوندگان در سطح دانشگاه قندهار انجام شد. همچنین پایایی پرسشنامه به کمک آزمون آلفا کرونباخ، 895/0 برآورد گردید. پس از گردآوری داده ها با استفاده از آزمون رتبه بندی فریدمن مورد بررسی قرار گرفته و در هر سطح آموزشی، پژوهشی و سازمانی، بر اساس نظرات نمونه آماری حاضر در پژوهش، مهم ترین چالش ها بدست امده و چالش های پیش رو رتبه بندی شدند. مقایسه میانگین رتبه ها نشان می دهد که بالاترین میانگین رتبه (84/2) به ویژگی چالش های سازمانی اختصاص دارد و بدین معناست که مهم ترین چالش اساتید استادان تازه کار، چالش سازمانی است. بعد از این چالش، مهم ترین چالش اساتید به ترتیب شامل چالش های پژوهشی و چالش های آموزشی می باشد. ,محمد قهرمانی,Persian,چالش­های آموزشی  چالش‌های پژوهشی  چالش‌های سازمانی  اعضای هیأت علمی تازه‌کار  دانشگاه قندهار
41,عوامل مؤثر بر اثربخشی یادگیری الکترونیکی: تحلیل پدیدار شناسانه ویژگی های یادگیرنده ,یادگیرنده به عنوان یکی از عوامل اصلی تعیین کننده موفقیت و اثرگذار در یادگیری الکترونیکی معرفی شده است زیرا ماهیت یادگیری الکترونیکی، یادگیرنده محور است و او مسئول یادگیری خود است. از این رو، هدف پژوهش حاضر، شناسایی ویژگی های مؤثر یادگیرنده بر اثربخشی یادگیری الکترونیکی بود. متناسب با این هدف، رویکرد پژوهش کیفی و راهبرد پدیدارشناسی اتخاذ شده است. اعضای هیأت علمی و مدرسان دوره های یادگیری الکترونیکی در دانشگاه ها، جامعه این پژوهش بوده اند. مشارکت کنندگان با استفاده از روش نمونه گیری هدفمند ملاک محور، انتخاب شدند و از طریق مصاحبه نیمه ساختارمند نسبت به جمع آوری داده ها تا دستیابی محقق به اشباع نظری، اقدام شده است و در مصاحبه دوازدهم، اشباع نظری حاصل شده است. یافته ها با استفاده از روش کدگذاری تحلیل محتوای کیفی، در سه مرحله کد، خرده مقوله و مقوله مورد تجزیه و تحلیل قرار گرفتند. بر اساس یافته های حاصل از دوازه مورد مصاحبه، تعداد 102 کد، 13 خرده مقوله و 6 مقوله شامل «محور بودن یادگیرنده در فرایند یادگیری»، «تعامل یادگیرنده در فرایند یادگیری»، «ارزیاب بودن یادگیرنده در فرایند یادگیری»، «سواد یادگیرنده»، «خودراهبر بودن یادگیرنده» و «ویژگی های روان شناختی یادگیرنده» حاصل شد. با توجه به یافته های پژوهش، مدیران و برنامه ریزان دوره های یادگیری الکترونیکی در دانشگاه ها باید به نقش یادگیرنده در موفقیت و اثربخشی یادگیری الکترونیکی دانشگاهی توجه ویژه ای داشته باشند.,محمد قهرمانی,Persian,اثربخشی یادگیری الکترونیکی  یادگیرنده  یادگیری الکترونیکی
42,شناسایی شاخص های اثرگذار در طراحی سامانه موبایل موک برای آموزش مجازی کارکنان: یک مطالعه کیفی,هدف پژوهش حاضر شناسایی شاخصهای اثزگذار طراحی سامانه موبایل موک جهت آموزش مجازی کارکنان بود. از پایگاه های علمی پروکوییست، گوگل اِسکالِر، ساینِس دایرکت، ِامرالد ، ِاسکوپوس و ِاسپرینگر تعداد 28 مقاله انتخاب شد و  با روش مقایسه مستمر  و تحلیل محتوای کیفی  به منظور استخراج نظامند یافتههای متون پیشین تحلیل شدند. از درون متن مقالات و از طریق فرایند کدگذاری باز، کدگذاری محوری و کدگذاری انتخابی 27 مفهوم و 4 مقوله اصلی(شاخص) استخراج شد. یافتهها  نشان دادند که در طرّاحی موبایل موک باید به مقولههای تعامل سیّار، سیستم پشتیبانی آموزشی، پذیرش فنّاوری و سیستم پشتیبانی فنّی توجّه کرد. با توجه به یافتههای پژوهش ترکیب فرمت موک و یادگیری سیّار پتانسیل زیادی برای یادگیری غیررسمی و مادام العمر دارد و  توصیه میشود که کارکنان با تعامل با یکدیگر و یا حتی مطرح شدن آنها به عنوان پژوهشگر و اطلاع آنها از مسائل و دانش روز در جهت تحقق شایستگی حرف هایشان از طریق فنّاوری موبایل موک گام موثری بردارند. شناخت شاخصهای مهم در طراحی فنّاوری نوین موبایل موک در افزایش شایستگی حرف های و نوآوری سازمانی، از این جهت حائز اهمیت است که میتوان با هم افزایی متخصّصین در کنار یکدیگر به نفع ارتقای عملکرد کارکنان و نوآوری سازمانی سود جُست.,محمد قهرمانی,Persian,آموزش مجازی، توسعه حرفه ای، موک، موبایل موک، یادگیری سیّار
43,تعیین کنندگان اثربخشی یادگیری الکترونیکی: مطالعه ای کیفی بر مدرس,هدف: هدف پژوهش حاضر، شناسایی عوامل مرتبط با مدرس بر اثربخشی یادگیری الکترونیکی است. روش: متناسب با هدف، رویکرد پژوهش کیفی و استراتژی پدیدارشناسی اتخاذ شد. اعضای هیأت علمی و مدرسان دوره های یادگیری الکترونیکی رشته علوم تربیتی و روانشناسی تربیتی در دانشگاه های دولتی شهر تهران، جامعه این پژوهش را تشکیل دادند. با استفاده از روش نمونه گیری هدفمند ملاک محور، تعداد 12 نفر به عنوان نمونه پژوهش انتخاب و از طریق مصاحبه نیمه ساختارمند نسبت به جمع آوری داده ها اقدام شد. با استفاده از روش کدگذاری تحلیل محتوای کیفی، در سه مرحله کد، خرده مقوله و مقوله، داده ها مورد تجزیه و تحلیل قرار گرفتند. قابلیت اعتبار و اعتماد به یافته های بدست آمده نیز با روش های بررسی همکار، محاسبه درصد پایایی بین دو کدگذار، انتخاب هدفمند نمونه های پژوهش و فرایند رفت و برگشتی همراه با تأمل فرایند کدگذاری، مورد بررسی و سپس تأیید قرار گرفت. در مجموع، تعداد 145 کد، 8 خرده مقوله و 4 مقوله شناسایی شدند. بر اساس یافته های پژوهش، «تسهیل گری فرایند یادگیری»، «ایجاد انگیزه و علاقه در یادگیرنده»، «دانش مدرس» و «ویژگی های روانشناختی مدرس» از عوامل مؤثر در تعیین اثربخشی یادگیری الکترونیکی از سوی مدرس یادگیری الکترونیکی می باشند.,محمد قهرمانی,Persian,مربی اثربخشی آموزش الکترونیکی آموزش الکترونیکی
