id,title,text,author,language,keywords
76,Comparison of strategic planning documents in selected public universities of the country,"The purpose of this study is to compare the official documents of strategic planning in selected public universities of the country in order to answer these two main questions: what are the differences and similarities between the formal and content elements of strategic planning documents of the selected public universities? Is there a unique design in these documents that fits the specific characteristics of their intended university? The research uses a mixed method. In the qualitative section, the content analysis method was used to review and analyze university documents and patterns, and the quantitative method (descriptive statistics) was used to examine the matrix of differences and similarities between program documents and existing planning patterns. The sample universities were 10 including Shahid Beheshti, Tabriz, Kharazmi, Semnan, Shiraz, Amir Kabir Industrial, Isfahan Industrial, Sharif Industrial, Kashan and Mazandaran university. The selected strategic planning models were 11 including Mintzberg, Barker & Smith, Johnson, Nostridge, New Orleans, University Association, Claire, Cleland and King, Steiner, Wisconsin, Kaufman, and Herman model. The findings show that in examining the documents, there are different differences between the content elements of the mentioned universities, while in terms of examining the formal elements, there are many similarities between them. And this trend is also true for selected planning patterns. Therefore, it is concluded that none of the surveyed universities, especially in terms of content elements, have designed a specific model for their university, but have adapted them. And this adaptability can challenge the success of universities in enforcing regulatory program documents.",محمد یمنی دوزی سرخابی,En,اسناد برنامه ریزی استراتژیک، مدل های برنامه ریزی استراتژیک، برنامه ریزی آموزش عالی، مطالعه تطبیقی، دانشگاه های دولتی
77,آموزه‌های نظریه آشوب در نظام آموزش و برنامه درسی علوم تجربی در ایران,هدف این مطالعه، دست‌یابی به دلالت‌های نظریة آشوب برای آموزش علوم در نظام آموزش و پرورش ایران بود. بدین منظور با پیروی از روش استنباطی، نکته های همبسته با هدف تحقیق از میان منابع معتبر شناسایی شد. در این راستا، کوشــش به عمل آمد تا ضمن معرفی نظریه آشوب، امکان رسیدن به توافقی غیرتحمیلی بر سر تغییرات احتمالاً ضروری در برنامه آموزش علوم به میان کشیده شود. مهم‌ترین دستاوردهای این رویکرد، استنباط 8 ویژگی در آموزش علوم متأثر از نظریه آشوب بود. این ویژگی ها که در مقاله به طور مبسوط ارایه شد، عبارتند از: گشوده، پویا، خلاق و دگرگون؛ هیجان‌انگیز، غیرمنتظره، و بی تعادل؛ غیرقطعی، غیرقابل پیش‌بینی و غیرقابل کنترل؛ ارتباط و تعامل پویا، فعال و هم‌افزای عناصر و اجزاء با یکدیگر و با محیط؛ با حضور کنش‌گرانی با موقعیت‌ها، خصلت‌هاو استعدادهای مختلف با کارکردها و وظایف خاص؛ با کنش و رفتار انسان‌هایی با ظرفیت‌هاو توانایی خودراهبری و خودسازمان‌دهی؛ ابتکار عمل و خلاقیت برای مواجهه با ساخت دانش در بستر تغییرات آن به آن و تازه شونده؛ و آموزش میان‌رشته‌ای علوم.,رضا محمدی چابکی,Persian," پارادایم پیچیدگی, نظریه آشوب, آموزش علوم, نظام آموزش و پرورش ایران"
78,"
فهم مساله محور قرآن مبتنی بر رویکرد سازه گرایی واقع گرایانه"," مراجعه به قرآن از نظرگاه مسایل و پیش فهم های خواننده در مقابل تاکید بر درک دلالت اصلی متن, یک دوقطبی تقلیل گرایانه را در مقوله فهم قرآن رقم زده است که طرفداران هر دو قطب را از بهره مندی از ظرفیت های قطب دیگر باز داشته است. در پژوهش حاضر با هدف برون رفت از دوقطبی مذکور, نظریه سازه گرایی واقع گرایانه مورد استفاده قرار می گیرد. سازه گرایی واقع گرایانه رویکردی در معرفت شناسی است که شکل گیری معرفت را مبتنی بر دو پایه نظرگاه فاعل شناسا و واقعیت های عینی ساماندهی می کند. استفاده از این نظریه در فهم قرآن, از یک سو امکان ساخت سازه های شناختی از قرآن را متناسب با مسایل و نظرگاه خواننده فراهم می کند و از دیگر سو بدون گرایش به نسبی گرایی, برداشت های مساله محور را در محدوده دلالت متن ساماندهی می کند. بررسی دو آیه دارای ظرفیت های دلالی مختلف در این مقاله مبتنی بر روی آورد سازه گرایی واقع گرایانه, نشان می دهد که در فرایند فهم مساله محور قرآن, بین دو مولفه""مسایل و نظرگاه های خواننده"" و ""گستردگی ابعاد متن"" هم بستگی تام وجود دارد؛ به گونه ای که هر چه مسایل و نظرگاه های خواننده متنوع تر باشد, امکان راهیابی به ابعاد بیشتری از متن مهیا می شود و هر چه ابعاد دلالی فرازهایی از قرآن گسترده تر باشد, امکان به کارگیری مسایل و نظرگاه های بیشتری در فهم آن فراز وجود دارد.",رضا محمدی چابکی,Persian,فهم مسأله‌محور قرآن؛ سازه‌گرایی واقع‌گرایانه؛ مسائل خواننده؛ نظرگاه خواننده؛ دلالت لفظی متن
79,مطالعه تطبیقی استعاره تربیتی سفر در عرفان اسلامی و عرفان اومانیستی,"پژوهش حاضر با هدف بررسی تطبیقی استعاره تربیتی سفر در عرفان اسلامی و نقطه مقابل آن, عرفان اومانیستی انجام گرفته است. بدین جهت, به دو متن عرفانی نماینده عرفان اسلامی و نماینده عرفان اومانیستی مراجعه شد. در مورد اول, «منطق الطیر» اثر عطار نیشابوری و در مورد دوم, «کوه جادو» اثر توماس مان آلمانی, به عنوان نماینده اصلی دو عرفان مذکور انتخاب شدند. در این راستا, جهت دست یافتن به هدف پژوهش, از روش تفسیری, استنتاجی و تطبیقی بهره گرفته شده و یافته های حاصل از آن, در سه گام اصلی شامل تحلیل استعاره تربیتی سفر در منطق الطیر و کوه جادو (از منظر هفت نگاشت میان حوزه ای شامل رهرو یا رهروان سفر, راهبر یا راهبران سفر, مقصد نهایی سفر, مراحل سفر, ره توشه, مسیریابی و ملزومات سفر, راهبرد سفر و نیز رهاورد سفر), استنتاج دلالت های تربیتی (اصول و راهبردهای تربیتی) در دو اثر مذکور و تطبیق و مقایسه دو گام قبلی ارایه شد. نتایج پژوهش حاکی از آن است که استعاره تربیتی سفر بر مبنای عرفان اسلامی و عرفان اومانیستی, دو مسیر جداگانه برای تربیت تعریف می کند که با وجود اشتراکات فراوان میان این دو مسیر, منتهای متفاوتی برای آنها تصور می شود. از جمله اشتراکات میان این دو می توان به سلوک مرحله ای, آزادی و اختیار متربی و درون نگری و از تمایزات میان این دو می توان به جایگاه یا خاستگاه شناخت بودن انسان و غایت متفاوت آنها اشاره نمود.",رضا محمدی چابکی,Persian,"
استعاره تربیتی سفر منطق الطیر کوه جادو عرفان اسلامی عرفان اومانیستی"
80,"
گذار از نظریه به عمل در تربیت اسلامی","پژوهش حاضر تلاشی است جهت رفع شکاف دیرینه نظریه و عمل تربیتی, با در نظر گرفتن دیدگاه اسلامی در تربیت که بر اساس واسازی مفهوم شهادت انجام شده است. در این راستا, با تاکید بر نقش عامل اصیل در تربیت اسلامی, پیامبر یا رسول به مثابه نمود کاملی از انسان تربیت یافته و به عبارتی, شاهد و گواه عملی شدن نظریه های اصیل و واسطه اصلی میان حوزه نظر با میدان عمل در تربیت, مدنظر قرار گرفته است. از این رو, جریان گذار از نظریه به عمل تربیتی, ذیل این اصل اساسی تشریح می شود که نزدیک شدن به رسول, معیاری برای نزدیک تر شدن به حوزه عمل و نمودی عینی برای نظریه تربیت بوده و به تبع آن, فاصله گرفتن از این معیار تربیتی, نشان فصل بین نظر و عمل تربیتی است. بر این اساس, با توجه به سیره عملی رسول در تاریخ اسلام, گذار از نظر به عمل تربیتی در سه سطح یا فاز کلی شامل سطوح شناختی-عقلانی, عاطفی-هیجانی و رفتاری-عملیاتی و با معرفی دوازده مولفه اساسی معرفی شده است",رضا محمدی چابکی,Persian,"
تربیت اسلامی نظریه تربیتی عمل تربیتی"
81,از رنج تا گنج: تحلیل رویکردهای سه گانه به نقش تربیتی رنج,هر فردی در زندگی خود لزوماً با درد و رنج مواجه می‌شود؛ تا آنجا که می‌توان رنج را زبان مشترک انسان‌ها نامید. با توجه به اینکه این لحظه‌ها سخت‌ترین و غامض‌ترین تجربه‌های هر فرد است؛ تاثیرات عمیق و اساسی در زندگی و تربیت او به دنبال دارد. در این پژوهش، با روش توصیفی‌-‌‌تحلیلی، پس از مروری کلی بر جایگاه رنج در تاریخ اندیشه، سه رویکرد مختلف در مواجهه با رنج معرفی و تحلیل شده است: در رویکرد انفعالی، رنج چالشی غیر قابل تغییر در زندگی انسان محسوب می‌شود که آدمی باید از مواجهه با آن بگریزد. در رویکرد تدافعی، رنج مانعی برای رشد و تربیت انسان در نظر گرفته می‌شود که باید با آن مبارزه کرد. در رویکرد تکاملی، رنج بستری لازم برای تعالی انسان دانسته می‌شود که موجب یالفعل شدن استعدادهای وجودی آدمی است. نتیجه پژوهش نشان داد که رویکردهای انفعالی و تدافعی، نگاه جامع و واقع بینانه‌ای نسبت به رنج ندارند و تنها در رویکرد تکاملی می‌توان نقش تربیتی فعال و واقع‌بینانه‌ای برای رنج متصور شد.,رضا محمدی چابکی,Persian,فلسفه رنج؛ رویکرد انفعالی؛ رویکرد تدافعی؛ رویکرد تکاملی
82,تبیین جایگاه زبان در تقویت مبانی، تصریح اهداف و توسعه ی وسایل تربیت,"پژوهش حاضر به تبیین جایگاه زبان در تقویت مبانی, تصریح اهداف وتوسعه وسایل تربیت پرداخته است. روش پژوهش تحلیل اسنادی بوده, جامعه پژوهش کلیه اسناد و مدارک مرتبط با موضوع پژوهش می باشند که بدون نمونه گیری بررسی شده اند. گردآوری داده ها به وسیله فرم فیش برداری انجام و داده های حاصل به شیوه کیفی تحلیل شده اند. عمده ترین یافته های پژوهش عبارتند از: 1- زبان در تصریح مبانی تربیت, می تواند به ترتیب در حوزه مبنای فلسفی با؛ تحلیل زبان تدریس و یادگیری, تحلیل نقادانه مفاهیم و اصطلاحات تربیتی و توضیح ذهنیت انسان, در حوزه مبنای روان شناختی با؛ کمک به تدوین نظریه های یادگیری, روان شناسی زبان و روان شناسی اجتماعی و در حوزه مبنای جامعه شناختی نیز با؛ ترسیم رابطه زبان و فرهنگ, اهمیت زبان آموزشی کشور, تحکیم خط مشی های زبانی, تقویت هویت فرهنگی و روابط معلم - دانش آموز به تقویت مبانی تربیت کمک دهد. 2- زبان در تصریح اهداف تربیت, می تواند به ترتیب در سطح فردی با؛ بهبود رفتارهای زبانی فردی, سواد آموزی, تامین دانش حداقلی قواعد زبانی جهت کاربست توانایی های سطح بالا, تفکرمنطقی و حل مساله, در سطح اجتماعی با؛ توسعه فرهیختگی, تقویت یادگیری مشارکتی, رشد مهارت های تعامل اجتماعی, شایستگی کنش گفتاری در روابط اجتماعی و در سطح جهانی با؛ بهبود رفتارهای سطح بالا زبانی در شرایط جهانی شدن, برقراری ارتباط مطلوب با سایر فرهنگ ها به وضوح اهداف تربیت کمک دهد. 3- زبان در تصریح وسایل تربیت, می تواند به ترتیب در حوزه برنامه ریزی های آموزش و پرورش با؛ تحلیل نیازهای آموزشی به لحاظ زبانی, برنامه ریزی زبانی و برنامه درسی زبانی, در حوزه تربیت معلم با؛ ایجاد ارتباط موفق با دیگران و به کار بستن صحیح زبان, حل برخی مشکلات معلمان و توسعه توان تحلیل و آموزش تحلیلی مطالب و در حوزه تدریس و تفهیم با؛ تثبیت موقعیت اجتماعی دانش آموز در کلاس درس, امکان افزایش قدرت یادگیری, اصلاح و تقویت گفتگو به عنوان یکی از راهبرد های اصلی در تربیت فعال و وضوح و تمایز دهی به زبان محتوایی و تدریسی به توسعه وسایل تربیت کمک دهد.",رضا محمدی چابکی,Persian,زبان؛ زبان شناسی تربیتی؛ مبانی تربیت؛ اهداف تربیت؛ وسایل تربیت
83,تغییر نقش معلم مبتنی بر نظریه پیچیدگی: از بازنمایی به تسهیل نوپدیدی,هدف مطالعه حاضر، بازاندیشی درباره نقش معلم در فرایند یاددهی/یادگیری مبتنی بر نظریه پیچیدگی است. برای این منظور نقش معلم در بینش سنتی کمنیوس و نیز بینش منتقدانه دیوئی مطرح شده و از نقش معلم در نظریه پیچیدگی دفاع شده است به گونه ای که مطالعه حاضر انگاره تسهیلگر نوپدیدی را به جای انگاره معلم بازنمایاننده پیشنهاد می کند. چنین است که نقش تسهیلگری مطابق با نظریه پیچیدگی، فراهم کردن بستر مناسب برای مشارکت همراه با درگیری و توجه، گوش فرادادن هرمنوتیکی، بکار آمدن نیروی تخیل و فی البداهگی، و نوپدیداری تفسیرهای گوناگون و پدیداری دانش و آگاهی نوپدید زمانی، غیرخطی، پیش بینی ناپذیر، خودسازمان و مشترک است. با چنین بینشی تسهیلگری و یادگیری همچون دو امر همزمان و پیوسته، که هیچ یک به معلم یا فراگیران نیز محدود نمی شوند، بسترساز نوپدیدآیی دانش زمانی و مشترک در سطح کلاس است.,رضا محمدی چابکی,Persian,نظریه پیچیدگی، تسهیلگری، نوپدیدی، بازنمایی
84,"بررسی دیدگاه دانش آموزان پایه سوم دوره متوسطه پیرامون تحقق اهداف قلمرو ""عمل و رفتار"" برنامه درسی دین و زندگی","هدف از انجام این پژوهش بررسی دیدگاه دانش‌آموزان دوره متوسطه پایه سوم پیرامون دست‌یابی به اهداف برنامه درسی دین و زندگی در حیطه عمل و رفتار است. این حیطه؛ براساس راهنمای برنامه‌درسی، با هفت مفهوم اساسی ‌از جمله: مبانی و اصول دین، قرآن کریم، سنت و سیره، انسان در اسلام، جامعه اسلامی، راه زندگی و دین در دنیای جدید مرتبط است. روش مطالعه، ارزشیابی با استفاده از روش‌های پیمایشی و ارزیابی ملاک‌مدار بود. جامعه آماری دانش‌آموزان شهر تهران بودند که از این جامعه تعداد 420 نفر براساس روش نمونه‌گیری خوشه‌ای چند مرحله‌ای به عنوان نمونه انتخاب شدند. ابزار پژوهش، پرسش‌نامه محقق ساخته بود که روایی و پایایی آن توسط معیارهای روانسنجی مورد تایید قرارگرفت. داده‌های حاصله با استفاده از روش‌های توصیفی از جمله میانگین و درصد و آزمون آماری تی تک نمونه‌ای مورد تجزیه و تحلیل قرارگرفت. یافته‌های حاصله حاکی از این است که دانش‌آموزان اعم از دختر و پسر دست‌یابی خود را به اهداف مربوط به ""مبانی و اصول دین، قرآن کریم و انسان در اسلام"" مطلوب گزارش نمودند. در قلمرو ""سنت و سیره"" علی‌رغم این که در مواردی دانش‌آموزان دست‌یابی خود را به اهداف این بخش مطلوب گزارش نموده‌اند اما عمدتاً دیدگاه آنان در این بخش نامطلوب می‌باشد. در بخش ""جامعه اسلامی"" علی‌رغم این که در مواردی دانش‌آموزان دست‌یابی خود را به این بخش نامطلوب گزارش نموده‌اند اما عمدتاً دیدگاه آنان در این بخش مطلوب گزارش شده است. در بخش ""راه زندگی"" عمدتاً دانش‌آموزان دست‌یابی خود را به این بخش نامطلوب گزارش نمودند. لازم به ذکر است که در مفاهیم هفت‌گانه تفاوت معناداری بین دیدگاه‌های دختران و پسران مشاهده نشد.",رضا محمدی چابکی,Persian,ارزشیابی، اهداف برنامه درسی، دین و زندگی، دیدگاه دانش آموزان، عمل و رفتار
85,فهم مسأله محور قرآن مبتنی بر رویکرد سازه‌گرایی واقع‌گرایانه,"مراجعه به قرآن از نظرگاه مسائل و پیش‌فهم‌های خواننده در مقابل تأکید بر درک دلالت اصلی متن، یک دوقطبی تقلیل‌گرایانه را در مقوله فهم قرآن رقم زده است که طرفداران هر دو قطب را از بهره‌مندی از ظرفیت‌های قطب دیگر باز داشته است. در پژوهش حاضر با هدف برون‌رفت از دوقطبی مذکور، نظریه سازه‌گرایی واقع‌گرایانه مورد استفاده قرار می‌گیرد. سازه‌گرایی واقع‌گرایانه رویکردی در معرفت‌شناسی است که شکل‌گیری معرفت را مبتنی بر دو پایه نظرگاه فاعل شناسا و واقعیت‌های عینی ساماندهی می‌کند. استفاده از این نظریه در فهم قرآن، از یک سو امکان ساخت سازه‌های شناختی از قرآن را متناسب با مسائل و نظرگاه خواننده فراهم می‌کند و از دیگر سو بدون گرایش به نسبی‌گرایی، برداشت‌های مسأله‌محور را در محدوده دلالت متن ساماندهی می‌کند. بررسی دو آیه دارای ظرفیت‌های دلالی مختلف در این مقاله مبتنی بر روی‌آورد سازه‌گرایی واقع‌گرایانه، نشان می‌دهد که در فرایند فهم مسأله‌محور قرآن، بین دو مؤلفه""مسائل و نظرگاه‌های خواننده"" و ""گستردگی ابعاد متن"" هم‌بستگی تام وجود دارد؛ به گونه‌ای که هر چه مسائل و نظرگاه‌های خواننده متنوع‌تر باشد، امکان راهیابی به ابعاد بیشتری از متن مهیا می‌شود و هر چه ابعاد دلالی فرازهایی از قرآن گسترده‌تر باشد، امکان به کارگیری مسائل و نظرگاه‌های بیشتری در فهم آن فراز وجود دارد.",رضا محمدی چابکی,Persian,فهم مسأله‌محور قرآن؛ سازه‌گرایی واقع‌گرایانه؛ مسائل خواننده؛ نظرگاه خواننده؛ دلالت لفظی متن
86,تاریخ فلسفه تعلیم و تربیت در ایران ,هدف اصلی این مقاله بررسی تاریخ فلسفه تعلیم و تربیت ایران در دوران معاصر است. فلسفه تعلیم و تربیت به‌مثابه‌ی رشته‌ای دانشگاهی نقطه‌ی آغاز معینی دارد: یکشنبه، 24 فوریه‌ی 1935، زمانی که انجمن جان دیویی در اتلانتیک سیتی در ایالت نیوجرسی امریکا تأسیس شد. در ایران رشته‌ی فلسفه تعلیم و تربیت سابقه‌ی بسیار کوتاه‌تری دارد. در واقع تاریخچه‌ی ثبت شده‌ای برای این منظور وجود ندارد. از سوی دیگر بررسی دقیق روند توسعه‌ی هر رشته با ارجاع به افراد و سازمان‌های حرفه‌ای که در تشکیل و جهت‌گیری آن نقش کلیدی ایفا کرده‌اند، امکان پذیر است. در نتیجه، در این پژوهش با استفاده از روش تاریخی و اسناد و مدارک مکتوب (با اعتبارسنجی آن‌ها) و اسناد شفاهی (به‌وسیله‌ی مصاحبه‌ی نیمه ساخت یافته با متخصصان این رشته در ایران) اطلاعات مورد نظر گردآوری و تحلیل شده است. نتایج نشان می‌دهند که منابع فراوانی در این رشته در ایران منتشر شده‌اند. با وجود این، بررسی این آثار حکایت می‌کند که فیلسوفان تربیتی در ایران بیشتر به سودآوری فلسفه برای معلمان و دانش‌آموزان گرایش دارند. در نتیجه چنین به‌نظر می‌رسد که ما باید خود را به‌عنوان فیلسوفان تربیتی اصیل بازیابیم و تمایز میان فلسفه‌ی محض و فلسفه تعلیم و تربیت را از میان برداریم. به‌عبارت دیگر، هدف نخست فیلسوف تربیتی باید ناظر به توسعه و تعمیق فهم مباحث فلسفی‌ای باشد که در فرایند تربیت رخ می‌نماید. بنابراین، فهم مبانی فلسفی تعلیم و تربیت و نه بهبود عمل آموزش باید در کانون اصلی توجه متخصصان این رشته قرار گیرد.,رضا محمدی چابکی,Persian," تاریخ, ایران, علوم تربیتی, فلسفه تعلیم و تربیت"
